{
  "schema_version": 1,
  "source": {
    "type": "moxfield_public_deck",
    "deck_id": "gvyGvOx0g0uJ7ultPy-pbw",
    "url": "https://moxfield.com/decks/gvyGvOx0g0uJ7ultPy-pbw",
    "endpoint": "https://api2.moxfield.com/v3/decks/all/gvyGvOx0g0uJ7ultPy-pbw"
  },
  "deck_name": "Creature Factory",
  "moxfield_version": 10,
  "moxfield_updated_at": "2026-10-31T02:26:52.26Z",
  "retrieved_at": "2026-10-31T05:49:07.998806Z",
  "content_hash": "eba02158c15ec00d2bb0bb648adb1805bb093726350c03005a137fcbf7f601bb",
  "counts": {
    "commanders": 2,
    "mainboard": 98
  },
  "commanders": [
    {
      "name": "Thrasios, Triton Hero",
      "quantity": 1,
      "scryfall_id": "21e27b91-c7f1-4709-aa0d-8b5d81b22a0a"
    },
    {
      "name": "Tymna the Weaver",
      "quantity": 1,
      "scryfall_id": "bc7cbe9b-324e-42b8-94e2-36e91cb32163"
    }
  ],
  "cards": [
    {
      "name": "Abhorrent Oculus",
      "quantity": 1,
      "scryfall_id": "d2705b43-a94a-44c0-8740-82e0b296820c"
    },
    {
      "name": "Ancient Tomb",
      "quantity": 1,
      "scryfall_id": "30e401e3-282b-4524-87e1-c6cd50cd6d00"
    },
    {
      "name": "Avacyn's Pilgrim",
      "quantity": 1,
      "scryfall_id": "7eb39e97-53c2-4df0-9fb3-a3d6a24ec41f"
    },
    {
      "name": "Badgermole Cub",
      "quantity": 1,
      "scryfall_id": "340c5799-4964-44dd-8c48-8f3f3aba5211"
    },
    {
      "name": "Bayou",
      "quantity": 1,
      "scryfall_id": "412ceddd-2b9a-4551-a6bf-ae2830a2010a"
    },
    {
      "name": "Birds of Paradise",
      "quantity": 1,
      "scryfall_id": "55fe6449-1f23-43dc-adee-d144cd505b5c"
    },
    {
      "name": "Birthing Pod",
      "quantity": 1,
      "scryfall_id": "b768efa2-e56b-4a7e-ace8-d673f10e0714"
    },
    {
      "name": "Boseiju, Who Endures",
      "quantity": 1,
      "scryfall_id": "2135ac5a-187b-4dc9-8f82-34e8d1603416"
    },
    {
      "name": "Chord of Calling",
      "quantity": 1,
      "scryfall_id": "e064174b-8f07-4fea-9eef-c3b5d0220b1a"
    },
    {
      "name": "Chrome Mox",
      "quantity": 1,
      "scryfall_id": "6a058e68-70af-4a64-859c-c881e5578368"
    },
    {
      "name": "City of Brass",
      "quantity": 1,
      "scryfall_id": "f4e32327-380d-471e-813b-4c27477787ce"
    },
    {
      "name": "City of Traitors",
      "quantity": 1,
      "scryfall_id": "a7a8b6b8-b95f-4014-b17a-a6d44d965995"
    },
    {
      "name": "Clever Impersonator",
      "quantity": 1,
      "scryfall_id": "cd8fffd3-81ad-47e3-a27b-d8059f2b506f"
    },
    {
      "name": "Command Tower",
      "quantity": 1,
      "scryfall_id": "46982091-cc78-4171-8b3d-d07592684728"
    },
    {
      "name": "Commandeer",
      "quantity": 1,
      "scryfall_id": "7e6e6204-c622-4efe-ac4f-8195528cec9c"
    },
    {
      "name": "Crop Rotation",
      "quantity": 1,
      "scryfall_id": "6563f790-862c-465a-b963-7a61f2385516"
    },
    {
      "name": "Delighted Halfling",
      "quantity": 1,
      "scryfall_id": "71384418-173a-4f77-adab-56e52fa23692"
    },
    {
      "name": "Delney, Streetwise Lookout",
      "quantity": 1,
      "scryfall_id": "be219928-3d0e-4d00-b124-152ce8a8c13b"
    },
    {
      "name": "Demonic Tutor",
      "quantity": 1,
      "scryfall_id": "711d4d54-5520-4de8-9b93-79902ed8e562"
    },
    {
      "name": "Derevi, Empyrial Tactician",
      "quantity": 1,
      "scryfall_id": "3d61a4d4-f0d5-4bc4-8977-57bbb3d97776"
    },
    {
      "name": "Devoted Druid",
      "quantity": 1,
      "scryfall_id": "820e2f07-f637-4144-b45a-0e1430dcf55e"
    },
    {
      "name": "Eldritch Evolution",
      "quantity": 1,
      "scryfall_id": "efcb00e5-2caa-45c8-ad19-05d45c683d16"
    },
    {
      "name": "Elvish Spirit Guide",
      "quantity": 1,
      "scryfall_id": "5b94f37f-ebdf-4b79-a615-58331d27cf4e"
    },
    {
      "name": "Emergence Zone",
      "quantity": 1,
      "scryfall_id": "ab95f6e7-b806-47fe-a071-6c38b3176d94"
    },
    {
      "name": "Endurance",
      "quantity": 1,
      "scryfall_id": "eb0e0404-4846-4891-acfa-bd0951ecf9c6"
    },
    {
      "name": "Enduring Vitality",
      "quantity": 1,
      "scryfall_id": "9d76a30c-0431-4334-892a-9822dda9671a"
    },
    {
      "name": "Enlightened Tutor",
      "quantity": 1,
      "scryfall_id": "cbac1d27-15e2-4e2f-82ab-625a16e096cb"
    },
    {
      "name": "Esper Sentinel",
      "quantity": 1,
      "scryfall_id": "f3537373-ef54-4578-9d05-6216420ee349"
    },
    {
      "name": "Exotic Orchard",
      "quantity": 1,
      "scryfall_id": "6aae6480-4e71-4d94-a648-f80d3849d792"
    },
    {
      "name": "Faerie Mastermind",
      "quantity": 1,
      "scryfall_id": "52d3005f-a1c7-4ef5-911f-ccc0752f4181"
    },
    {
      "name": "Fierce Guardianship",
      "quantity": 1,
      "scryfall_id": "4c5ffa83-c88d-4f5d-851e-a642b229d596"
    },
    {
      "name": "Finale of Devastation",
      "quantity": 1,
      "scryfall_id": "985453e7-997e-4d77-a338-cc0290791ebe"
    },
    {
      "name": "Flare of Denial",
      "quantity": 1,
      "scryfall_id": "71a98efb-9b0a-496b-ac21-8d70527ea544"
    },
    {
      "name": "Flash Photography",
      "quantity": 1,
      "scryfall_id": "2bca2cd2-4d4a-44e4-87c3-732692b77921"
    },
    {
      "name": "Flooded Strand",
      "quantity": 1,
      "scryfall_id": "b4e3d844-d3b4-41d8-921d-c1cb3af343f8"
    },
    {
      "name": "Flusterstorm",
      "quantity": 1,
      "scryfall_id": "1e2e09bf-e7c8-4f13-bcee-f9c8cbc57993"
    },
    {
      "name": "Force of Negation",
      "quantity": 1,
      "scryfall_id": "e9be371c-c688-44ad-ab71-bd4c9f242d58"
    },
    {
      "name": "Force of Will",
      "quantity": 1,
      "scryfall_id": "9a879b60-4381-447d-8a5a-8e0b6a1d49ca"
    },
    {
      "name": "Gaea's Cradle",
      "quantity": 1,
      "scryfall_id": "25b0b816-0583-44aa-9dc5-f3ff48993a51"
    },
    {
      "name": "Gemstone Caverns",
      "quantity": 1,
      "scryfall_id": "94d74254-4750-4fb3-9e53-473a5f98b315"
    },
    {
      "name": "Gilded Drake",
      "quantity": 1,
      "scryfall_id": "8de3fdae-cc2c-4a14-b15b-4fe1a983dfbf"
    },
    {
      "name": "Gleaming Splendor",
      "quantity": 1,
      "scryfall_id": "3b087bd4-bbb7-4963-bdb6-0a700ff19a04"
    },
    {
      "name": "Grand Abolisher",
      "quantity": 1,
      "scryfall_id": "67e35a40-37dd-436c-b4ac-b17b04508c1f"
    },
    {
      "name": "Hazel's Brewmaster",
      "quantity": 1,
      "scryfall_id": "52af8b70-a9c8-40d7-99da-fa51dc293688"
    },
    {
      "name": "High Fae Trickster",
      "quantity": 1,
      "scryfall_id": "7f1b93ea-1ec1-4010-9343-765742f5088b"
    },
    {
      "name": "Imperial Seal",
      "quantity": 1,
      "scryfall_id": "822e30db-40c5-4099-868b-185ad9b7c7dc"
    },
    {
      "name": "Kinnan, Bonder Prodigy",
      "quantity": 1,
      "scryfall_id": "63cda4a0-0dff-4edb-ae67-a2b7e2971350"
    },
    {
      "name": "Lotho, Corrupt Shirriff",
      "quantity": 1,
      "scryfall_id": "ce01ff8f-a037-484f-9148-c847ffaabc5a"
    },
    {
      "name": "Lotus Petal",
      "quantity": 1,
      "scryfall_id": "6c877da3-68fa-41d0-8a24-8c79fcd8ecc1"
    },
    {
      "name": "Machine God's Effigy",
      "quantity": 1,
      "scryfall_id": "98980aaa-2932-4513-af7e-ada537b899e3"
    },
    {
      "name": "Mana Confluence",
      "quantity": 1,
      "scryfall_id": "504a69eb-3c2d-4bb1-b117-252b15acf0c2"
    },
    {
      "name": "Mana Vault",
      "quantity": 1,
      "scryfall_id": "19499cb7-eccb-4e69-af32-6002d447a160"
    },
    {
      "name": "Marsh Flats",
      "quantity": 1,
      "scryfall_id": "45026d57-0324-4312-8b86-2e7d4f581ee9"
    },
    {
      "name": "Mental Misstep",
      "quantity": 1,
      "scryfall_id": "61e9c6df-1c84-4eab-9076-a4feb6347c10"
    },
    {
      "name": "Mindbreak Trap",
      "quantity": 1,
      "scryfall_id": "4f51140b-6254-431a-8810-94307bfdfbbe"
    },
    {
      "name": "Misdirection",
      "quantity": 1,
      "scryfall_id": "581ad59c-29e9-4498-a6fd-33bf21e8e7c4"
    },
    {
      "name": "Misty Rainforest",
      "quantity": 1,
      "scryfall_id": "24a5cc2c-0fbf-4a5f-b175-6e0ffd0d0787"
    },
    {
      "name": "Mockingbird",
      "quantity": 1,
      "scryfall_id": "ade32396-8841-4ba4-8852-d11146607f21"
    },
    {
      "name": "Mox Amber",
      "quantity": 1,
      "scryfall_id": "6ea9852b-78fa-4732-8801-4ce632270558"
    },
    {
      "name": "Mox Diamond",
      "quantity": 1,
      "scryfall_id": "28028830-83ed-45e2-b495-3b9ad9d3e988"
    },
    {
      "name": "Mystic Remora",
      "quantity": 1,
      "scryfall_id": "58e93dff-b774-4765-b7bd-d3957e42ff4a"
    },
    {
      "name": "Nature's Rhythm",
      "quantity": 1,
      "scryfall_id": "1397d904-c51d-451e-8505-7f3118acc1f6"
    },
    {
      "name": "Neoform",
      "quantity": 1,
      "scryfall_id": "92d8f67e-4f2f-4a1f-b190-7c3f39e477e4"
    },
    {
      "name": "Noble Hierarch",
      "quantity": 1,
      "scryfall_id": "6adfe928-1305-444d-b709-1e714544daaf"
    },
    {
      "name": "Oboro Breezecaller",
      "quantity": 1,
      "scryfall_id": "a382a9b8-0b19-46c2-a547-a22d6e23d0ac"
    },
    {
      "name": "Orcish Bowmasters",
      "quantity": 1,
      "scryfall_id": "7c024bae-5631-4e20-ac69-df392ac9e109"
    },
    {
      "name": "Otawara, Soaring City",
      "quantity": 1,
      "scryfall_id": "486d7edc-d983-41f0-8b78-c99aecd72996"
    },
    {
      "name": "Pact of Negation",
      "quantity": 1,
      "scryfall_id": "cca467a2-a2b3-4bdf-9d60-62979f675347"
    },
    {
      "name": "Polluted Delta",
      "quantity": 1,
      "scryfall_id": "0f7585c8-9e21-4eef-afc1-2852de23db2f"
    },
    {
      "name": "Ranger-Captain of Eos",
      "quantity": 1,
      "scryfall_id": "af3928b4-813a-4120-8799-de34235d60ac"
    },
    {
      "name": "Rhystic Study",
      "quantity": 1,
      "scryfall_id": "3394cefd-a3c6-4917-8f46-234e441ecfb6"
    },
    {
      "name": "Savannah",
      "quantity": 1,